{
 "$schema": "https://json-schema.org/draft/2020-12/schema",
 "$id": "sr-record.schema.json",
 "$comment": "contract-v1.2 C-16: the single SrRecord schema (src/contracts/fragments.ts SrRecord). MAT verify-a11y-manual.mjs and the QUAL aggregator both read this file. REQ-FIN-110 (additive): the optional L13 binding fields stream, pass and storybookArtifactUrl, the step narrative fields action/expected/announced, the device touch ATs and a numeric (or null) flagship; the verifier's L13 profile makes them required for records under tests/a11y/manual/records/.",
 "title": "SrRecord",
 "type": "object",
 "additionalProperties": false,
 "required": [
  "flagship",
  "at",
  "result",
  "date",
  "tester",
  "sha"
 ],
 "properties": {
  "flagship": {
   "type": [
    "string",
    "integer",
    "null"
   ]
  },
  "at": {
   "enum": [
    "voiceover-macos",
    "voiceover-ios",
    "nvda-chrome",
    "talkback-chrome",
    "touch",
    "touch-ios",
    "touch-android"
   ]
  },
  "result": {
   "enum": [
    "pass",
    "fail"
   ]
  },
  "date": {
   "type": "string"
  },
  "tester": {
   "type": "string"
  },
  "notes": {
   "type": "string"
  },
  "sha": {
   "type": "string"
  },
  "atVersion": {
   "type": "string",
   "minLength": 1
  },
  "browser": {
   "type": "string",
   "minLength": 1
  },
  "browserVersion": {
   "type": "string",
   "minLength": 1
  },
  "os": {
   "type": "string",
   "minLength": 1
  },
  "osVersion": {
   "type": "string",
   "minLength": 1
  },
  "device": {
   "type": "string",
   "minLength": 1
  },
  "subject": {
   "type": "string",
   "minLength": 1
  },
  "steps": {
   "type": "array",
   "minItems": 1,
   "items": {
    "type": "object",
    "additionalProperties": false,
    "required": [
     "nameRoleValue",
     "stateChange",
     "openClose",
     "liveRegion",
     "pass"
    ],
    "properties": {
     "nameRoleValue": {
      "type": "string"
     },
     "stateChange": {
      "type": "string"
     },
     "openClose": {
      "type": "string"
     },
     "liveRegion": {
      "type": "string"
     },
     "gesture": {
      "type": "string"
     },
     "nonDragAlternative": {
      "type": "string"
     },
     "pass": {
      "type": "boolean"
     },
     "notes": {
      "type": "string"
     },
     "action": {
      "type": "string"
     },
     "expected": {
      "type": "string"
     },
     "announced": {
      "type": "string"
     }
    }
   }
  },
  "stream": {
   "enum": [
    "mat",
    "cmp",
    "surf"
   ]
  },
  "pass": {
   "enum": [
    "sr",
    "touch",
    "motion"
   ]
  },
  "storybookArtifactUrl": {
   "type": "string",
   "pattern": "^https://"
  }
 }
}
